<?xml version="1.0" encoding="UTF-8"?>
<projectRecord xmlns:xsi="http://www.w3.org/2001/XMLSchema-instance"
 xsi:noNamespaceSchemaLocation="file:/home/hc/Desktop/DAW/DAW2020/TPC2/ProjectRecord.xsd" id="ID000">
    <header>
        <dates begin="wLUByg7HyVomGfHcC9H.xNty5Xz" end="bU"/>
        <titles>
            <bigTitle>y_O9OkJ0rQX2kD7gR1IYyeq</bigTitle>
            <keyName>rjFuAe2n6.aN4aIoBqdt</keyName>
            <title>MzgyhhF-0EKxNeCaIPJgrpVl</title>
            <subtitle>J9GkeIIbOayToS8DTXDsrbg-n5Xvtq</subtitle>
        </titles>
        <supervisor svRef="DWpF">
        </supervisor>
    </header>
    <workteam>
        <teammate tmmRef="YZ.f6J" numMecan="hNPl">
        </teammate>
        <teammate tmmRef="cRBQ" numMecan="wsIFXJ3">
        </teammate>
    </workteam>
    <abstract>
        <p sizePriority="5">
            <br/>
            <i>
                <b>
                    <u>
                        <ref link="U9uRaQkBcbmo915-Um">
                        </ref>
                        <ref link="mXhtlWh75-n2nc5F">
                        </ref>
                    </u>
                    <br/>
                </b>
                <b>
                    <u>
                        <br/>
                        <ref link="DS53v.utF3Jm3kO">
                        </ref>
                    </u>
                    <br/>
                </b>
            </i>
        </p>
        <p sizePriority="5">
            <ref link="mndgfcXAPwMVqAji0SQTZ8tgGc">
                <u>
                    <br/>
                    <br/>
                </u>
                <u>
                    <b>
                        <br/>
                        <i>
                            <br/>
                            <br/>
                        </i>
                    </b>
                    <b>
                        <i>
                            <br/>
                            <br/>
                        </i>
                        <br/>
                    </b>
                </u>
            </ref>
            <ref link="Y..">
                <i>
                    <br/>
                    <u>
                        <br/>
                        <br/>
                    </u>
                </i>
                <u>
                    <i>
                        <br/>
                        <b>
                            <br/>
                            <br/>
                        </b>
                    </i>
                    <b>
                        <i>
                            <br/>
                            <br/>
                        </i>
                        <i>
                            <br/>
                            <br/>
                        </i>
                    </b>
                </u>
            </ref>
        </p>
    </abstract>
    <footer>
        <deliverables>
            <ref link="KJ3P8G.ehEtVliR34xWBCQs0dJF.G">
                <i>
                    <br/>
                    <br/>
                </i>
                <i>
                    <br/>
                    <u>
                        <br/>
                        <br/>
                    </u>
                </i>
            </ref>
            <ref link="TlyMjwGm4QMSFzqnj">
                <b>
                    <p sizePriority="5">
                        <br/>
                        <br/>
                    </p>
                    <i>
                        <p sizePriority="5">
                            <br/>
                            <u>
                                <br/>
                                <br/>
                            </u>
                        </p>
                        <u>
                            <p sizePriority="5">
                                <br/>
                                <br/>
                            </p>
                            <p sizePriority="5">
                                <br/>
                                <br/>
                            </p>
                        </u>
                    </i>
                </b>
                <b>
                    <p sizePriority="5">
                        <i>
                            <br/>
                            <u>
                                <br/>
                                <br/>
                            </u>
                        </i>
                        <u>
                            <br/>
                            <i>
                                <br/>
                                <br/>
                            </i>
                        </u>
                    </p>
                    <u>
                        <p sizePriority="5">
                            <br/>
                            <br/>
                        </p>
                        <p sizePriority="5">
                            <br/>
                            <i>
                                <br/>
                                <br/>
                            </i>
                        </p>
                    </u>
                </b>
            </ref>
        </deliverables>
        <pubDate>AHwbtRg0OJHKdMXU</pubDate>
    </footer>
</projectRecord>
